{
  "$schema": "https://json-schema.org/draft/2020-12/schema",
  "$id": "urn:q1x:community:contracts:v1:mission",
  "title": "Mission",
  "type": "object",
  "required": [
    "contractVersion",
    "id",
    "title",
    "objective",
    "outcomes",
    "status",
    "createdAt"
  ],
  "properties": {
    "contractVersion": {
      "const": "1.0.0"
    },
    "id": {
      "$ref": "urn:q1x:community:contracts:v1:common#/$defs/identifier"
    },
    "title": {
      "type": "string",
      "minLength": 1
    },
    "objective": {
      "type": "string",
      "minLength": 1
    },
    "outcomes": {
      "type": "array",
      "minItems": 1,
      "items": {
        "type": "object",
        "required": [
          "id",
          "description",
          "successCriteria"
        ],
        "properties": {
          "id": {
            "$ref": "urn:q1x:community:contracts:v1:common#/$defs/identifier"
          },
          "description": {
            "type": "string",
            "minLength": 1
          },
          "successCriteria": {
            "type": "array",
            "minItems": 1,
            "items": {
              "type": "string",
              "minLength": 1
            }
          }
        },
        "additionalProperties": false
      }
    },
    "constraints": {
      "type": "object",
      "additionalProperties": true
    },
    "tags": {
      "type": "array",
      "uniqueItems": true,
      "items": {
        "type": "string",
        "minLength": 1
      }
    },
    "status": {
      "enum": [
        "proposed",
        "active",
        "paused",
        "completed",
        "cancelled"
      ]
    },
    "createdAt": {
      "$ref": "urn:q1x:community:contracts:v1:common#/$defs/timestamp"
    }
  },
  "additionalProperties": false
}
